{
  "specversion": "1.0",
  "id": "event-business-partner-requested",
  "source": "urn:cp6:crm",
  "type": "com.gtx537.crm.erp.business-partner-requested.v1",
  "subject": "tenants/11111111-1111-4111-8111-111111111111/33333333-3333-4333-8333-333333333333",
  "time": "2026-09-12T12:00:00Z",
  "datacontenttype": "application/json",
  "dataschema": "https://contracts.cp6.uk/events/crm/erp-business-partner-requested/v1/schema.json",
  "tenantid": "11111111-1111-4111-8111-111111111111",
  "correlationid": "correlation-1",
  "causationid": "command-1",
  "aggregateid": "33333333-3333-4333-8333-333333333333",
  "aggregateversion": 7,
  "schemaversion": "1.0.0",
  "region": "us",
  "data": {
    "tenantId": "11111111-1111-4111-8111-111111111111",
    "requestId": "22222222-2222-4222-8222-222222222222",
    "accountId": "33333333-3333-4333-8333-333333333333",
    "requestVersion": 1
  }
}
